{
  "schema_version": "1.0.0",
  "ticket": "TASK-109",
  "risk_level": "high",
  "req_ids": [
    "REQ-PAY-27",
    "REQ-PAY-28"
  ],
  "depends_on": [
    "TASK-098",
    "TASK-099",
    "TASK-100"
  ],
  "acceptance_criteria": [
    {
      "id": "AC-TASK-109-01",
      "type": "functional",
      "statement": "Lead-unlock pricing resolves from admin-configurable category tiers with district and effective-window overrides and is used consistently during lead unlock checkout.",
      "test_ids": [
        "TID-TASK-109-DOMAIN-TIERED-LEAD-PRICING"
      ]
    },
    {
      "id": "AC-TASK-109-02",
      "type": "functional",
      "statement": "Taskers with 5 or more completed bookings before the first paid-product launch receive a permanent `grandfathered` flag and a 5 percent discount on eligible future paid products.",
      "test_ids": [
        "TID-TASK-109-DOMAIN-GRANDFATHERING-ELIGIBILITY"
      ]
    },
    {
      "id": "AC-TASK-109-03",
      "type": "functional",
      "statement": "Grandfathering discounts are applied at checkout for credit packs and subscriptions, remain auditable, and never reduce price below configured minimum floor rules.",
      "test_ids": [
        "TID-TASK-109-API-GRANDFATHERING-CHECKOUT"
      ]
    }
  ]
}
