{
  "schema_version": "1.0.0",
  "ticket": "TASK-020",
  "risk_level": "medium",
  "req_ids": [
    "REQ-TASK-05"
  ],
  "depends_on": [
    "TASK-001"
  ],
  "acceptance_criteria": [
    {
      "id": "AC-TASK-020-01",
      "type": "functional",
      "statement": "Public endpoint returns only active categories.",
      "test_ids": [
        "TID-TASK-020-API-CATEGORIES-PUBLIC"
      ]
    },
    {
      "id": "AC-TASK-020-02",
      "type": "functional",
      "statement": "Admin can create/update/deactivate categories.",
      "test_ids": [
        "TID-TASK-020-API-CATEGORIES-ADMIN-CRUD"
      ]
    },
    {
      "id": "AC-TASK-020-03",
      "type": "functional",
      "statement": "On a clean database startup, at least 5 MVP categories are present and active.",
      "test_ids": [
        "TID-TASK-020-API-CATEGORIES-SEED-PRESENT"
      ]
    }
  ]
}
