{
  "schema_version": "1.0.0",
  "ticket": "TASK-097",
  "risk_level": "high",
  "req_ids": [
    "REQ-ADMIN-06",
    "REQ-ADMIN-07"
  ],
  "depends_on": [
    "TASK-020",
    "TASK-045"
  ],
  "acceptance_criteria": [
    {
      "id": "AC-TASK-097-01",
      "type": "functional",
      "statement": "Feature toggle panel can enable/disable lead-fee, subscription, and escrow without redeploy and writes actor/time",
      "test_ids": [
        "TID-TASK-097-API-FEATURE-TOGGLE-RUNTIME"
      ]
    },
    {
      "id": "AC-TASK-097-02",
      "type": "functional",
      "statement": "Concierge dispatch can manually assign eligible verified tasker to task with mandatory override reason and actor.",
      "test_ids": [
        "TID-TASK-097-AUDIT-FEATURE-TOGGLE"
      ]
    },
    {
      "id": "AC-TASK-097-03",
      "type": "functional",
      "statement": "Toggle effects are applied at runtime without restart and are observable in system status endpoints.",
      "test_ids": [
        "TID-TASK-097-API-CONCIERGE-ASSIGN"
      ]
    }
  ]
}
