{
  "schema_version": "1.0.0",
  "ticket": "TASK-011",
  "risk_level": "medium",
  "req_ids": [
    "REQ-AUTH-01"
  ],
  "depends_on": [
    "TASK-010"
  ],
  "acceptance_criteria": [
    {
      "id": "AC-TASK-011-01",
      "type": "functional",
      "statement": "`GET/PUT /users/me` supports profile retrieval/update.",
      "test_ids": [
        "TID-TASK-011-API-PROFILE-GET-PUT"
      ]
    },
    {
      "id": "AC-TASK-011-02",
      "type": "functional",
      "statement": "Avatar presigned upload endpoint returns constrained upload URL and storage key.",
      "test_ids": [
        "TID-TASK-011-API-AVATAR-UPLOAD-URL"
      ]
    }
  ]
}
