{
  "schema_version": "1.0.0",
  "ticket": "TASK-034",
  "risk_level": "high",
  "req_ids": [
    "REQ-PAY-04",
    "REQ-PAY-05",
    "REQ-PAY-06"
  ],
  "depends_on": [
    "TASK-033"
  ],
  "acceptance_criteria": [
    {
      "id": "AC-TASK-034-01",
      "type": "functional",
      "statement": "Tasker can request payout only up to available balance.",
      "test_ids": [
        "TID-TASK-034-API-PAYOUT-REQUEST"
      ]
    },
    {
      "id": "AC-TASK-034-02",
      "type": "functional",
      "statement": "Admin can list/process pending payouts.",
      "test_ids": [
        "TID-TASK-034-API-ADMIN-PAYOUT-PROCESS"
      ]
    },
    {
      "id": "AC-TASK-034-03",
      "type": "functional",
      "statement": "Processing enforces Tue/Fri schedule policy and writes ledger entries.",
      "test_ids": [
        "TID-TASK-034-DOMAIN-PAYOUT-SCHEDULE"
      ]
    },
    {
      "id": "AC-TASK-034-04",
      "type": "functional",
      "statement": "When the monetization feature flag is disabled, wallet endpoints return FEATURE_DEFERRED (503).",
      "test_ids": [
        "TID-TASK-034-API-MONETIZATION-DEFERRED"
      ]
    },
    {
      "id": "AC-TASK-034-05",
      "type": "reliability",
      "statement": "Duplicate booking completion credit events for the same booking are idempotent: only one credit is applied to the tasker's balance.",
      "test_ids": [
        "TID-TASK-034-DOMAIN-WALLET-DEDUP"
      ]
    }
  ]
}
