{
  "schema_version": "1.0.0",
  "ticket": "TASK-013",
  "risk_level": "high",
  "req_ids": [
    "REQ-AUTH-04",
    "REQ-SAFE-01"
  ],
  "depends_on": [
    "TASK-012"
  ],
  "acceptance_criteria": [
    {
      "id": "AC-TASK-013-01",
      "type": "functional",
      "statement": "Admin can list pending verifications.",
      "test_ids": [
        "TID-TASK-013-API-ADMIN-VERIFICATION-LIST"
      ]
    },
    {
      "id": "AC-TASK-013-02",
      "type": "functional",
      "statement": "Admin approve/reject transitions user verification status correctly.",
      "test_ids": [
        "TID-TASK-013-API-ADMIN-VERIFICATION-APPROVE"
      ]
    }
  ]
}
