{
  "schema_version": "1.0.0",
  "ticket": "TASK-111",
  "risk_level": "low",
  "req_ids": [
    "NFR-RELI-01"
  ],
  "depends_on": [
    "TASK-070",
    "TASK-071"
  ],
  "acceptance_criteria": [
    {
      "id": "AC-TASK-111-01",
      "type": "functional",
      "statement": "Base local compose remains focused on backend services while a generic `docker-compose.web.yml` overlay defines the `web` service and configurable published port.",
      "test_ids": [
        "TID-TASK-111-ENV-WEB-CONTAINER-OVERLAY"
      ]
    },
    {
      "id": "AC-TASK-111-02",
      "type": "functional",
      "statement": "The generic web overlay builds the web container from `apps/web/Dockerfile`, and the internal Caddy runtime preserves SPA fallback for client routes.",
      "test_ids": [
        "TID-TASK-111-WEB-CADDY-SPA-FALLBACK"
      ]
    },
    {
      "id": "AC-TASK-111-03",
      "type": "functional",
      "statement": "Repo runbook docs describe the generic overlay commands and published port while leaving reverse proxy, TLS, ingress, and host networking to the deployment environment.",
      "test_ids": [
        "TID-TASK-111-DOC-GENERIC-CONTAINER-RUNBOOK"
      ]
    }
  ]
}
