{
  "schema_version": "1.0.0",
  "ticket": "TASK-095",
  "risk_level": "high",
  "req_ids": [
    "NFR-OBS-02",
    "REQ-LEAK-01",
    "REQ-LEAK-02",
    "REQ-LEAK-03",
    "REQ-LEAK-04",
    "REQ-LEAK-05",
    "REQ-MSG-03"
  ],
  "depends_on": [
    "TASK-022",
    "TASK-042",
    "TASK-043"
  ],
  "acceptance_criteria": [
    {
      "id": "AC-TASK-095-01",
      "type": "functional",
      "statement": "Tasker phone fields are excluded from all customer-facing payloads and UI contracts.",
      "test_ids": [
        "TID-TASK-095-API-TASKER-PHONE-HIDDEN"
      ]
    },
    {
      "id": "AC-TASK-095-02",
      "type": "functional",
      "statement": "Customer phone is masked until selected tasker accepts booking and paid lead unlock succeeds in paid phases.",
      "test_ids": [
        "TID-TASK-095-API-CUSTOMER-PHONE-MASKING"
      ]
    },
    {
      "id": "AC-TASK-095-03",
      "type": "security",
      "statement": "Exact address reads are blocked until allowed lifecycle/payment milestone and unauthorized requests return",
      "test_ids": [
        "TID-TASK-095-API-ADDRESS-LOCK"
      ],
      "negative_test_ids": [
        "TID-TASK-095-API-ADDRESS-LOCK"
      ]
    },
    {
      "id": "AC-TASK-095-04",
      "type": "functional",
      "statement": "Message pipeline flags phone-sharing patterns and emits admin alert events; Phase 0-1 actions remain advisory.",
      "test_ids": [
        "TID-TASK-095-DOMAIN-MESSAGE-LEAKAGE-FLAG"
      ]
    },
    {
      "id": "AC-TASK-095-05",
      "type": "functional",
      "statement": "Booking confirmation and dispute intake explicitly surface no-recourse notice for off-platform arrangements.",
      "test_ids": [
        "TID-TASK-095-API-NO-RECOURSE-NOTICE"
      ]
    },
    {
      "id": "AC-TASK-095-06",
      "type": "functional",
      "statement": "Messaging payloads preserve in-app-first communication policy and hide tasker contact in all phases.",
      "test_ids": [
        "TID-TASK-095-AUTO-AC-06"
      ]
    }
  ]
}
