{
  "schema_version": "1.0.0",
  "ticket": "TASK-063",
  "risk_level": "high",
  "req_ids": [
    "NFR-PERF-01"
  ],
  "depends_on": [
    "TASK-022"
  ],
  "acceptance_criteria": [
    {
      "id": "AC-TASK-063-01",
      "type": "performance",
      "statement": "Feed query plan uses appropriate indexes (including geospatial).",
      "test_ids": [
        "TID-TASK-063-PERF-INDEX-PLAN"
      ]
    },
    {
      "id": "AC-TASK-063-02",
      "type": "performance",
      "statement": "p95 latency for `GET /tasks` remains under target in perf smoke profile.",
      "test_ids": [
        "TID-TASK-063-PERF-TASK-FEED-P95"
      ]
    },
    {
      "id": "AC-TASK-063-03",
      "type": "performance",
      "statement": "Regression budget enforced in CI performance smoke.",
      "test_ids": [
        "TID-TASK-063-PERF-CI-REGRESSION-BUDGET"
      ]
    }
  ]
}
