{
  "schema_version": "1.0.0",
  "ticket": "TASK-116",
  "risk_level": "low",
  "req_ids": [
    "NFR-SEC-01",
    "NFR-API-02",
    "NFR-OBS-01",
    "NFR-UI-01"
  ],
  "depends_on": [],
  "acceptance_criteria": [
    {
      "id": "AC-TASK-116-01",
      "type": "functional",
      "statement": "A production-readiness audit document assesses the current system against the PRD, architecture doctrine, deployment constraints, and security baseline with evidence-backed findings.",
      "test_ids": [
        "TID-TASK-116-DOC-AUDIT-SCOPE"
      ]
    },
    {
      "id": "AC-TASK-116-02",
      "type": "functional",
      "statement": "A remediation spec defines the target production-ready state, the major gaps blocking release, and the required release gates to close those gaps.",
      "test_ids": [
        "TID-TASK-116-DOC-REMEDIATION-SPEC"
      ]
    },
    {
      "id": "AC-TASK-116-03",
      "type": "functional",
      "statement": "An implementation plan sequences the remediation work into ordered streams with concrete verification expectations for reaching production readiness.",
      "test_ids": [
        "TID-TASK-116-DOC-IMPLEMENTATION-PLAN"
      ]
    }
  ]
}
