{
  "schema_version": "1.0.0",
  "ticket": "TASK-061",
  "risk_level": "medium",
  "req_ids": [
    "NFR-LOC-01"
  ],
  "depends_on": [
    "TASK-002"
  ],
  "acceptance_criteria": [
    {
      "id": "AC-TASK-061-01",
      "type": "functional",
      "statement": "Backend resolves localized error/template messages by locale with `mn` fallback.",
      "test_ids": [
        "TID-TASK-061-BE-LOCALE-RESOLUTION"
      ]
    },
    {
      "id": "AC-TASK-061-02",
      "type": "functional",
      "statement": "Web and mobile apps load `mn` as default locale.",
      "test_ids": [
        "TID-TASK-061-WEB-MN-DEFAULT"
      ]
    },
    {
      "id": "AC-TASK-061-03",
      "type": "functional",
      "statement": "Cyrillic input/rendering is validated in critical flows.",
      "test_ids": [
        "TID-TASK-061-MOBILE-MN-DEFAULT"
      ]
    }
  ]
}
