{
  "schema_version": "1.0.0",
  "ticket": "TASK-072",
  "risk_level": "medium",
  "req_ids": [
    "NFR-UI-02"
  ],
  "depends_on": [
    "TASK-070",
    "TASK-071"
  ],
  "acceptance_criteria": [
    {
      "id": "AC-TASK-072-01",
      "type": "functional",
      "statement": "Web UI flows touched by changes pass keyboard navigation checks.",
      "test_ids": [
        "TID-TASK-072-WEB-A11Y-KEYBOARD"
      ]
    },
    {
      "id": "AC-TASK-072-02",
      "type": "functional",
      "statement": "Web UI flows touched by changes meet WCAG 2.1 AA contrast.",
      "test_ids": [
        "TID-TASK-072-WEB-A11Y-CONTRAST-AA"
      ]
    },
    {
      "id": "AC-TASK-072-03",
      "type": "functional",
      "statement": "Cross-platform parity checks validate token usage and expected component state behavior.",
      "test_ids": [
        "TID-TASK-072-CROSS-PLATFORM-PARITY-CHECK"
      ]
    }
  ]
}
