{
  "schema_version": "1.0.0",
  "ticket": "TASK-114",
  "risk_level": "medium",
  "req_ids": [
    "NFR-UI-02",
    "REQ-BOOK-01",
    "REQ-BOOK-02",
    "REQ-TASK-02"
  ],
  "depends_on": [
    "TASK-023",
    "TASK-070"
  ],
  "acceptance_criteria": [
    {
      "id": "AC-TASK-114-01",
      "type": "functional",
      "statement": "Customer task and booking detail pages resolve routed `taskId` and `bookingId` params instead of scaffolded fallback identifiers.",
      "test_ids": [
        "TID-TASK-114-WEB-ROUTE-PARAM-LOAD"
      ]
    },
    {
      "id": "AC-TASK-114-02",
      "type": "functional",
      "statement": "The applicants page loads the routed task's applicants and wires profile and accept actions to the live IDs.",
      "test_ids": [
        "TID-TASK-114-WEB-APPLICANTS-ACTIONS"
      ]
    },
    {
      "id": "AC-TASK-114-03",
      "type": "functional",
      "statement": "Customer applicant and booking pages remove placeholder scaffolding copy from rendered output.",
      "test_ids": [
        "TID-TASK-114-WEB-SCAFFOLD-CLEANUP"
      ]
    }
  ]
}
